{
  "artifact_type": "runtime.control",
  "schema_version": "1",
  "status": "compiled",
  "control_chain": {
    "requirements": "requirements.control.json",
    "design": "design.control.json",
    "goal": "goal.control.json",
    "plan": "plan.control.json",
    "review": "review.control.json"
  },
  "approved_control": {
    "objective": "Execute the approved JSON control chain.",
    "what_counts_as_done": "Verifier permits the final report after required progress evidence is present."
  },
  "registry_bindings": {
    "answer_method_key": "implementation-spine",
    "selected_agent_workflow": "superpowers-dispatching-parallel-agents"
  },
  "runtime": {
    "readonly_files": [
      "requirements.control.json",
      "design.control.json",
      "goal.control.json",
      "plan.control.json",
      "review.control.json",
      "runtime.control.json"
    ],
    "writable_files": [
      "progress.jsonl",
      "runtime-status.json",
      "final-report.json"
    ]
  },
  "required_steps": [
    {
      "step_id": "S8",
      "transition": "runtime points at JSON control files only",
      "evidence": [
        "runtime control example"
      ],
      "satisfies_outcomes": [
        "O-json-control-example"
      ]
    }
  ],
  "progress": {
    "event_schema": "progress-event.schema.json",
    "append_only": true
  },
  "verifier": {
    "required_before_goal_achieved": true,
    "command": "verify-control-run",
    "output_schema": "final-report.schema.json",
    "required_outcomes": [
      "O-json-control-example"
    ]
  },
  "semantic_base_ref": {
    "id": "semantic-base:control-example",
    "hash": "sha256:c012b8f869390414051a8c583f3032f32f7fa8be19cdf81364e2c39c32eafa2e"
  },
  "approved_control_hashes": {
    "requirements.control.json": "sha256:32bc8e78fb702486d9e269da6d438c40c862a5cb74b522a274fc025bd8d2ae30",
    "design.control.json": "sha256:579e85ecd094d2d602510ff8d8eb57731173e878af4f452cc7d0ae48e81d2db9",
    "goal.control.json": "sha256:80aeadd8ac285c832a6c3669ea772d4c2126f164af8b2af6dbdeb9792a52b160",
    "plan.control.json": "sha256:ee61712488a91b273391ac6582287e6e4fba6ac0d3362b85b2fc7c7623370ef4",
    "review.control.json": "sha256:8e2f3591046102742c7dc400fb36bf42f1ecf42dda4f48fae629fd988a59e2e2",
    "runtime.control.json": "sha256:4e0be7a23425a1cc85dfc2b9abcc73e6d1a7592b9a9155f688573562e24d62e5"
  }
}
